{
  "$schema": "https://json-schema.org/draft/2020-12/schema",
  "$id": "https://mapsmith.dev/spec/manifest-v1.schema.json",
  "x-spec-version": "1.0.0-draft.3",
  "title": "Provenance manifest for a geospatial dataset",
  "description": "One record, written next to one output dataset, complete enough that someone who was not there can re-run the operation and disagree with it. A manifest records what was done; it does not certify that it was right — those are different claims, and this format only makes the first.",
  "type": "object",
  "required": [
    "spec_version",
    "operation",
    "parameters",
    "inputs",
    "engine",
    "verification",
    "started_at",
    "finished_at"
  ],
  "additionalProperties": true,
  "properties": {
    "spec_version": {
      "type": "string",
      "pattern": "^1\\.[0-9]+\\.[0-9]+(-[0-9A-Za-z.-]+)?$",
      "description": "The version of this specification the record conforms to. Semantic versioning; this schema accepts any 1.x.y. A record without it cannot be interpreted once the format has more than one version, which is why it is the one field that can never be optional."
    },
    "operation": {
      "type": "string",
      "minLength": 1,
      "description": "What was done, as a stable identifier (e.g. `watershed`, `buffer_layer`). Producers choose their own vocabulary; consumers must not assume one."
    },
    "parameters": {
      "type": "object",
      "description": "The exact parameters the engine ran with — not the ones requested, the ones used. May be empty, but must be present: an absent field cannot be told apart from 'nobody recorded them'."
    },
    "inputs": {
      "type": "array",
      "description": "Every dataset the operation read. May be empty for pure generators. Order is not significant.",
      "items": {
        "type": "object",
        "required": [
          "path",
          "sha256"
        ],
        "additionalProperties": true,
        "properties": {
          "path": {
            "type": "string",
            "minLength": 1,
            "pattern": "^[^\\\\]*$",
            "description": "Where the input lived, with `/` as the only separator on every platform. A path that carries the host's separator makes two manifests for the same run differ in a field that describes nothing about the computation. Recorded as given (relative stays relative, absolute stays absolute): rewriting it would misstate what ran."
          },
          "sha256": {
            "type": "string",
            "pattern": "^[0-9a-f]{64}$",
            "description": "SHA-256 of the input's bytes, lowercase hex. The bytes, not the filename: a manifest whose input has been edited since stops matching, and says so."
          },
          "crs": {
            "type": [
              "string",
              "null"
            ],
            "description": "The input's coordinate reference system as a short label (e.g. `EPSG:32610`), or null when it has none. A label, not an identity: consumers comparing coordinate systems need the datasets, not this string."
          },
          "layer": {
            "type": [
              "string",
              "null"
            ],
            "description": "The layer read, for container formats holding more than one. Without it, an auditor holding a five-layer container and this record cannot tell which layer produced the numbers."
          }
        }
      }
    },
    "output": {
      "type": "object",
      "required": [
        "path",
        "sha256"
      ],
      "additionalProperties": true,
      "properties": {
        "path": {
          "type": "string",
          "minLength": 1,
          "pattern": "^[^\\\\]*$",
          "description": "The output dataset this manifest describes, same path rules as inputs."
        },
        "sha256": {
          "type": "string",
          "pattern": "^[0-9a-f]{64}$",
          "description": "SHA-256 of the output's bytes at the moment the manifest was written."
        }
      },
      "description": "RECOMMENDED. The digest of the dataset this record sits beside. Without it, a consumer cannot verify that the sidecar describes the bytes next to it — and the record cannot be wrapped in an in-toto attestation, whose subject requires a digest. Recommended rather than mandatory only because a producer may emit the manifest before the output is durably on disk; when it can be computed, it should be."
    },
    "engine": {
      "type": "object",
      "required": [
        "name",
        "version"
      ],
      "additionalProperties": true,
      "properties": {
        "name": {
          "type": "string",
          "minLength": 1
        },
        "version": {
          "type": "string",
          "minLength": 1,
          "description": "Which build produced the numbers. Algorithms change between releases, and so do their outputs; an engine without a version is not reproducible, only imitable."
        }
      },
      "description": "The software that computed the result — the engine, not the orchestrator that called it."
    },
    "verification": {
      "type": "array",
      "minItems": 1,
      "description": "Deterministic checks that ran on the result, recorded whether they passed or failed. At least one: a manifest with no checks at all is a log entry wearing a manifest's clothes. Failed checks MUST be recorded rather than suppressed — the audit trail has to survive the error it documents.",
      "items": {
        "type": "object",
        "required": [
          "name",
          "passed",
          "detail"
        ],
        "additionalProperties": true,
        "properties": {
          "name": {
            "type": "string",
            "description": "A stable code a consumer can branch on. MUST be one of the core names in section 3.6 of the specification, or an extension named `x-<producer>:<name>`. A name that is neither is a conformance error: an unconstrained vocabulary makes two records incomparable, which is the point of having a format.",
            "anyOf": [
              {
                "enum": [
                  "crs_present",
                  "crs_matches",
                  "geometry_valid",
                  "feature_count_exact",
                  "feature_count_bounded",
                  "row_count_exact",
                  "result_not_empty",
                  "extent_within_expected",
                  "shape_preserved",
                  "values_in_expected_range",
                  "input_crs_present",
                  "input_not_empty",
                  "inputs_share_crs",
                  "inputs_may_intersect",
                  "geometry_types"
                ]
              },
              {
                "pattern": "^x-[a-z0-9][a-z0-9_-]*:[a-z0-9][a-z0-9_]*$"
              }
            ]
          },
          "passed": {
            "type": "boolean"
          },
          "detail": {
            "type": "string",
            "description": "What was observed, in enough words to argue with. A bare boolean is a score, not a record."
          },
          "critical": {
            "type": "boolean",
            "description": "Whether a failure of this check should have stopped the pipeline. Optional; absent means the producer makes no claim."
          },
          "hint": {
            "type": [
              "string",
              "null"
            ]
          },
          "argument": {
            "type": [
              "string",
              "null"
            ],
            "description": "Which input or parameter the check is about. Without it, two inputs produce identically named entries that a consumer indexing by name collapses."
          }
        }
      }
    },
    "started_at": {
      "type": "string",
      "pattern": "^[0-9]{4}-[0-9]{2}-[0-9]{2}T[0-9]{2}:[0-9]{2}:[0-9]{2}(\\.[0-9]+)?Z$",
      "description": "When the operation started, RFC 3339, UTC only (`Z`). Local times make two manifests disagree about the order of events depending on where they are read."
    },
    "finished_at": {
      "type": "string",
      "pattern": "^[0-9]{4}-[0-9]{2}-[0-9]{2}T[0-9]{2}:[0-9]{2}:[0-9]{2}(\\.[0-9]+)?Z$",
      "description": "When it finished, same form. MUST NOT precede started_at (checked semantically; a pattern cannot)."
    },
    "crs_decisions": {
      "type": "object",
      "description": "RECOMMENDED. Coordinate-system decisions and the reason for each. `analysis_crs` and `reason` are strings; other values may be of any type, because the question a consumer most needs answered here (was the transformation a ballpark one?) has to be answerable in a form a program can branch on. Section 3.7 fixes the keys.",
      "properties": {
        "analysis_crs": {
          "type": "string",
          "description": "The coordinate system the operation actually computed in."
        },
        "reason": {
          "type": "string",
          "description": "Why that system, in words a reader can check, naming the alternative rejected where there was one."
        },
        "source_crs": {
          "type": [
            "string",
            "null"
          ],
          "description": "The CRS the coordinates were in before the operation."
        },
        "target_crs": {
          "type": [
            "string",
            "null"
          ],
          "description": "The CRS they were put into, when the operation transformed them."
        },
        "transformation": {
          "type": "object",
          "additionalProperties": true,
          "properties": {
            "pipeline": {
              "type": [
                "string",
                "null"
              ],
              "description": "The transformation operation string the engine used."
            },
            "accuracy_m": {
              "type": [
                "number",
                "null"
              ],
              "description": "The transformation's stated accuracy in metres, or null when the engine states none."
            },
            "is_ballpark": {
              "type": "boolean",
              "description": "True when no datum transformation was available and the engine treated the datums as equivalent. A boolean and not prose: a consumer has to be able to branch on it."
            }
          },
          "description": "How the coordinates were transformed. Section 3.7."
        }
      },
      "additionalProperties": true
    },
    "notes": {
      "type": "array",
      "items": {
        "type": "string"
      },
      "description": "RECOMMENDED. Disclosures about how inputs were handled before the engine saw them (workarounds, plain copies, normalisations)."
    },
    "repairs": {
      "type": "array",
      "items": {
        "type": "object"
      },
      "description": "RECOMMENDED. Mechanical repairs applied to the output, each one disclosed. An undisclosed repair makes the manifest describe a file that never existed."
    },
    "parameters_redacted": {
      "type": "boolean",
      "description": "RECOMMENDED. True when redaction changed anything in this record. A manifest that silently differs from what ran is a worse defect than the secret it protects."
    },
    "producer": {
      "type": "object",
      "properties": {
        "name": {
          "type": "string"
        },
        "version": {
          "type": "string"
        }
      },
      "description": "RECOMMENDED. The software that emitted this record, as distinct from the engine that computed the result."
    },
    "environment": {
      "type": "object",
      "additionalProperties": {
        "type": "string"
      },
      "description": "RECOMMENDED. The configuration that influenced the result and lives neither in the data nor in the call: PROJ_NETWORK, GDAL_* variables, a project-level ellipsoid, AREA_OR_POINT, the presence of a datum grid. The correct answer is not a number, it is this number with this configuration. Section 3.8."
    }
  }
}
