{
  "spec_version": "1.0.0-draft.6",
  "producer": {
    "name": "example-producer",
    "version": "0.1.0"
  },
  "operation": "buffer_layer",
  "parameters": {
    "distance_meters": 300.0
  },
  "inputs": [
    {
      "path": "rivers.gpkg",
      "sha256": "b24b884f49eee431133d443d842557d3ed21f3978e2c4b1e8e072fd1240effe8",
      "crs": "EPSG:4267"
    }
  ],
  "crs_decisions": {
    "analysis_crs": "EPSG:32614",
    "reason": "estimated UTM zone for metric buffering on a geographic CRS",
    "round_trip": {
      "transformation": {
        "pipeline": null,
        "accuracy_m": 7.0,
        "is_ballpark": false
      },
      "return_transformation": {
        "pipeline": null,
        "accuracy_m": 7.0,
        "is_ballpark": false
      }
    }
  },
  "engine": {
    "name": "example-engine",
    "version": "1.0"
  },
  "environment": {},
  "verification": [
    {
      "name": "input_crs_present",
      "passed": true,
      "detail": "'input_path': EPSG:4267"
    },
    {
      "name": "input_not_empty",
      "passed": true,
      "detail": "'input_path': 1 features"
    },
    {
      "name": "result_not_empty",
      "passed": true,
      "detail": "1 features"
    },
    {
      "name": "crs_present",
      "passed": true,
      "detail": "EPSG:4267"
    },
    {
      "name": "crs_matches",
      "passed": true,
      "detail": "expected EPSG:4267, got EPSG:4267"
    },
    {
      "name": "geometry_valid",
      "passed": true,
      "detail": "all valid"
    },
    {
      "name": "x-mapsmith:no_geometry_is_empty",
      "passed": true,
      "detail": "none empty"
    },
    {
      "name": "feature_count_exact",
      "passed": true,
      "detail": "expected 1, got 1"
    },
    {
      "name": "geometry_types",
      "passed": true,
      "detail": "expected subset of ['MultiPolygon', 'Polygon'], got ['Polygon']"
    }
  ],
  "started_at": "2026-08-18T10:15:03Z",
  "finished_at": "2026-08-18T10:15:04Z"
}
