{
  "spec_version": "1.0.0-draft.7",
  "operation": "hillshade",
  "parameters": {
    "azimuth": 315.0,
    "altitude": 30.0
  },
  "inputs": [
    {
      "path": "fixtures/dem.tif",
      "sha256": "166b1e4e7bc975d81ba049311c5713365e090dd1e8944a944ca241acf22633fa",
      "crs": "EPSG:32610"
    }
  ],
  "crs_decisions": {
    "analysis_crs": "EPSG:32610",
    "reason": "hillshade computed in the DEM's own projected CRS",
    "x-somevendor:raster_registration": "area",
    "x-somevendor:raster_registration_reason": "the file declares AREA_OR_POINT=Area"
  },
  "engine": {
    "name": "whitebox-workflows",
    "version": "2.0.6"
  },
  "verification": [
    {
      "name": "crs_present",
      "passed": true,
      "detail": "EPSG:32610"
    }
  ],
  "started_at": "2026-09-25T10:12:04Z",
  "finished_at": "2026-09-25T10:12:05Z"
}
