{
  "spec_version": "1.0.0-draft.10",
  "operation": "zonal_statistics",
  "parameters": {
    "statistics": [
      "weighted_mean"
    ]
  },
  "inputs": [
    {
      "path": "data/rainfall.tif",
      "sha256": "3f1c0a9d6b2e4f58a7c19d03e6b4a2f1c8d7e6b5a4f3e2d1c0b9a8f7e6d5c4b3",
      "crs": "EPSG:32633",
      "argument": "values"
    },
    {
      "path": "data/population.tif",
      "sha256": "9a8b7c6d5e4f30211a2b3c4d5e6f708192a3b4c5d6e7f8091a2b3c4d5e6f7081",
      "crs": "EPSG:32633",
      "argument": "weights",
      "environment": {
        "GDAL_GEOREF_SOURCES": "default (PAM,INTERNAL,TABFILE,WORLDFILE)",
        "sidecar": "population.tif.aux.xml present and read"
      }
    },
    {
      "path": "data/districts.gpkg",
      "sha256": "0d1e2f3a4b5c6d7e8f90a1b2c3d4e5f60718293a4b5c6d7e8f90a1b2c3d4e5f6",
      "crs": "EPSG:32633",
      "layer": "districts",
      "argument": "zones"
    }
  ],
  "engine": {
    "name": "exactextract",
    "version": "0.2.2"
  },
  "verification": [
    {
      "name": "crs_present",
      "passed": true,
      "detail": "EPSG:32633 on all three inputs"
    }
  ],
  "started_at": "2026-09-28T10:00:00Z",
  "finished_at": "2026-09-28T10:00:02Z"
}
